question;option1;option2;option3;correct
Krajský úřad je;správním orgánem příslušným k přezkoumávání rozhodnutí vydaných orgány obcí ve správním řízení;nadřízeným správním úřadem vůči obcím;správním úřadem; A
Krajský úřad tvoří;ředitel krajského úřadu a zaměstnanci kraje zařazení do krajského úřadu;hejtman, náměstek (náměstci) hejtmana, ředitel krajského úřadu a zaměstnanci kraje zařazení do krajského úřadu;hejtman, ředitel krajského úřadu a zaměstnanci kraje zařazení do krajského úřadu; A
Je-li ředitel krajského úřadu odvolán z funkce bez předchozího souhlasu ministra vnitra,;je odvolání neplatné, jen pokud tak rozhodne soud na návrh ředitele krajského úřadu nebo ministra vnitra;je odvolání neplatné, jen pokud tak rozhodne Ministerstvo vnitra ve správním řízení na návrh ředitele krajského úřadu;je odvolání neplatné; C
Ředitele krajského úřadu jmenuje do funkce;hejtman po předchozím souhlasu ministra vnitra;ministr vnitra po předchozím souhlasu zastupitelstva kraje;zastupitelstvo kraje po předchozím souhlasu ministra vnitra; A
Za plnění úkolů svěřených krajskému úřadu v přenesené působnosti je ředitel krajského úřadu odpovědný;hejtmanovi;ministrovi vnitra;předsedovi vlády; A
Za plnění úkolů svěřených krajskému úřadu v samostatné působnosti je ředitel krajského úřadu odpovědný;zastupitelstvu kraje;hejtmanovi;radě kraje; B
Ředitel krajského úřadu;je zaměstnancem kraje;je zaměstnancem krajského úřadu;je zaměstnancem Ministerstva vnitra; A
Členy zvláštního orgánu kraje jmenuje;rada kraje;ředitel krajského úřadu;hejtman; C
Úkoly statutárního orgánu zaměstnavatele vůči zaměstnancům kraje, zařazeným v krajském úřadě, plní;hejtman;náměstek (náměstci) hejtmana;ředitel krajského úřadu; C
Krajský úřad je;orgánem zastupitelstva kraje;zvláštním orgánem kraje;orgánem kraje; C
Při výkonu přenesené působnosti jsou orgány kraje podřízeny;vládě;Ministerstvu vnitra;věcně příslušnému ministerstvu nebo jinému věcně příslušnému ústřednímu správnímu úřadu; C
Rozhodnutí vydaná ve správním řízení orgány krajů přezkoumává;Ministerstvo vnitra;Úřad vlády České republiky;věcně příslušné ministerstvo a jiné věcně příslušné ústřední správní úřady; C
Dozor nad výkonem přenesené působnosti kraje provádí;věcně příslušné ministerstvo a jiné věcně příslušné ústřední správní úřady;Ministerstvo vnitra;vláda České republiky; A
Výkon usnesení nebo rozhodnutí orgánu kraje v samostatné působnosti pozastaví;Ministerstvo vnitra;rada kraje;ředitel krajského úřadu; A
Ústavní soud je za podmínek stanovených zákonem oprávněn;zrušit právní předpis kraje;zrušit usnesení rady kraje, pokud je v rozporu s usnesením zastupitelstva kraje;zrušit usnesení zastupitelstva kraje v samostatné působnosti; A
Zastupitelstvo kraje zřizuje;vždy finanční výbor a kontrolní výbor;vždy finanční výbor, kontrolní výbor a výbor pro národnostní menšiny;vždy finanční výbor, kontrolní výbor a výbor pro výchovu, vzdělávání a zaměstnanost; C
Usnesení rady kraje v samostatné působnosti, které je v rozporu se zákonem, může zrušit;rada kraje, která ho vydala, a za podmínek daných zákonem též zastupitelstvo kraje a soud;jen rada kraje, která ho vydala nebo soud za podmínek stanovených zákonem;jen soud za podmínek daných zákonem; A
Orgány zastupitelstva kraje;je krajský úřad;jsou výbory zastupitelstva kraje;je rada kraje; B
Kontrolní výbor;kontroluje plnění usnesení zastupitelstva a rady kraje;provádí kontrolu hospodaření s majetkem a finančními prostředky kraje;provádí kontrolu hospodaření právnických osob a zařízení založených nebo zřízených krajem; A
Dozor nad výkonem přenesené působnosti obcí vykonává;hejtman;zvláštní orgán kraje zřízený hejtmanem;krajský úřad v přenesené působnosti; C
Obecní úřad je;orgánem zastupitelstva obce;zvláštním orgánem obce;orgánem obce; C
Orgánem obce není;obecní úřad;zastupitelstvo obce;dobrovolný svazek obcí; C
Městem se může stát obec, pokud tak na návrh obce stanoví předseda Poslanecké sněmovny po vyjádření vlády, a jež má alespoň;2 000 obyvatel;1 000 obyvatel;3 000 obyvatel; C
Mandát člena zastupitelstva obce vzniká;zvolením;složením slibu;písemným souhlasem; A
Komise jako poradní orgány zřizuje;rada kraje;ředitel krajského úřadu;hejtman; A
K orgánům obce současně náležejí tyto;zastupitelstvo obce, rada obce, starosta, obecní úřad, zvláštní orgány obce, komise, jestliže jí byl svěřen výkon přenesené působnosti, a obecní policie;zastupitelstvo obce, rada obce, starosta, obecní úřad, zvláštní orgány obce, komise, jestliže jí byl svěřen výkon přenesené působnosti, obecní policie, výbory zastupitelstva obce a komise rady obce;zastupitelstvo obce, rada obce, starosta, obecní úřad, zvláštní orgány obce a komise, jestliže jí byl svěřen výkon přenesené působnosti, a výbory zastupitelstva obce; A
Právní předpisy kraje se vyhlašují;ve Sbírce zákonů České republiky;ve Věstníku právních předpisů kraje;ve Sbírce právních předpisů územních samosprávných celků a některých správních úřadů; C
Stanoví-li zvláštní zákon, že určitá věc náleží do působnosti obce,;jedná se o výkon samostatné působnosti tehdy, rozhodne-li o tom zastupitelstvo obce;jedná se o výkon samostatné působnosti, avšak toto musí zákon vždy výslovně stanovit;jedná se o výkon samostatné působnosti tehdy, pokud zvláštní zákon nestanoví, že se jedná o výkon přenesené působnosti; C
Stanoví-li zvláštní zákon, že určitá záležitost náleží do působnosti obce,;jedná se o výkon přenesené působnosti tehdy, pokud to zvláštní zákon stanoví;jedná se o výkon přenesené působnosti tehdy, rozhodne-li o tom rada obce;jedná se o výkon přenesené působnosti tehdy, rozhodne-li o tom zastupitelstvo obce; A
O výkon přenesené působnosti obce se jedná,;pokud to nařízení vlády výslovně stanoví;pokud to zvláštní zákon stanoví;pokud o tom rozhodne rada obce; B
Občanem obce je;fyzická osoba – státní občan České republiky – hlášená v obci k trvalému pobytu;fyzická osoba – státní občan České republiky – hlášená v obci k trvalému pobytu, která dosáhla věku 18 let;fyzická osoba – státní občan České republiky – hlášená v obci k trvalému pobytu a další fyzická osoba, která v obci není hlášena k trvalému pobytu, ale vlastní na území obce nemovitost; A
Obce s rozšířenou působností;mohou vydávat nařízení i pouze pro některý ze správních obvodů obcí, které netvoří jejich správní obvod;nemohou vydávat nařízení pro svůj správní obvod;mohou v přenesené působnosti vydávat na základě zákona a v jeho mezích nařízení obce pro správní obvod stanovený zvláštním právním předpisem; C
Nařízení obce;vydává tajemník obecního úřadu v obcích, kde je tato funkce zřízena;vydává rada obce, příp. zastupitelstvo v obci, kde rada není zřízena;vydává rada obce, pokud si tuto pravomoc nevyhradí zastupitelstvo obce; B
Obecně závaznou vyhlášku obce vydává;tajemník obecního úřadu;rada obce;zastupitelstvo obce; C
Obec je oprávněna vydávat tyto právní předpisy:;obecně závazné vyhlášky obce v samostatné působnosti a nařízení obce v přenesené působnosti;obecně závazné vyhlášky obce v samostatné působnosti, nařízení obce v přenesené působnosti a současně je obec oprávněna podávat návrhy zákonů;obecně závazné vyhlášky obce v přenesené působnosti a nařízení obce v samostatné působnosti; A
Obec je oprávněna vydat nařízení,;je-li k tomu zmocněna zákonem, na základě zákona a v jeho mezích, přičemž postačí splnění pouze jedné z uvedených podmínek;na základě zákona a v jeho mezích, přičemž výslovné zákonné zmocnění k vydání nařízení není třeba;je-li k tomu zákonem zmocněna, na základě zákona a v jeho mezích, přičemž všechny podmínky musí být splněny současně; C
Metodickou a odbornou pomoc pri výkonu prenesené púsobnosti obce zabezpecuje vuci orgánum obcí;Ministerstvo vnitra;krajský úrad a vecne príslusná ministerstva ci jiné vēcne príslusné ústrední správni úrady;krajský úrad; C
Výkonem prenesené pusobnosti obce je;vykon státní správy a samosprávy;vykon samosprávy;vykon státní správy; C
Úřední deska obecního úřadu;je zřizována obecním úřadem, musí být umístěna na budově, v níž má obecní úřad své sídlo, a musí být umístěna na místě, které musí být veřejně přístupné zpravidla po 24 hodin denně;je zřizována starostou obce, zpravidla se umísťuje na budově, v níž má starosta své sídlo, a je umístěna na místě, které musí být veřejně přístupné zpravidla po 24 hodin denně;musí být nepřetržitě veřejně přístupná, přičemž pro jednotlivé orgány obce se zřizuje jedna úřední deska (jak stanoví správní řád); C
Zákon o obcích;upravuje problematiku obcí, přičemž se nevztahuje na hlavní město Prahu;upravuje problematiku obcí, přičemž se v případě, že zákon o hlavním městě Praze nestanoví výslovně jinak, použije podpůrně též na městské části hlavního města Prahy;upravuje problematiku obcí, přičemž se v případě, že zákon o hlavním městě Praze nestanoví výslovně jinak, použije podpůrně též na hlavní město Prahu; A
Záměr obce směnit nebo darovat nemovitý majetek, pronajmout jej nebo poskytnout jako výpůjčku;musí obec zveřejnit po dobu 30 dnů před rozhodnutím v příslušném orgánu obce, aby se k němu mohli zájemci vyjádřit a předložit své nabídky;rada obce zveřejní po dobu nejméně 30 dnů před rozhodnutím v příslušném orgánu obce;obec zveřejní po dobu nejméně 15 dnů před rozhodnutím v příslušném orgánu obce vyvěšením na úřední desce obecního úřadu, aby se k němu mohli zájemci vyjádřit a předložit své nabídky; C
Tajemník obecního úřadu;odpovídá za plnění úkolů obecního úřadu v samostatné působnosti zastupitelstvu obce a za plnění úkolů obecního úřadu v přenesené působnosti starostovi, přičemž není-li tato funkce v obci zřízena nebo není-li tajemník ustanoven, plní jeho úkoly starosta;odpovídá za plnění úkolů obecního úřadu v samostatné i přenesené působnosti zastupitelstvu obce, přičemž není-li tato funkce v obci zřízena nebo není-li tajemník ustanoven, plní jeho úkoly rada obce, popř. zastupitelstvo obce;odpovídá za plnění úkolů obecního úřadu v samostatné i přenesené působnosti starostovi, přičemž není-li tato funkce v obci zřízena nebo není-li tajemník ustanoven, plní jeho úkoly starosta; C
Tajemník obecního úřadu;se zúčastňuje zasedání zastupitelstva obce s hlasem poradním;hlasuje na zasedání zastupitelstva obce, pokud je o účast na zasedání požádán;není oprávněn se zúčastňovat zasedání zastupitelstva obce; A
Funkce tajemníka obecního úřadu;musí být vždy zřizována v obcích s rozšířenou působností, v ostatních obcích může být tato funkce zřízena;nemůže být zřizována v každé obci;musí být vždy zřizována v obcích s pověřeným obecním úřadem a v obcích s rozšířenou působností, v ostatních obcích může být tato funkce zřízena; C
Obecní úřad je tvořen;zaměstnanci obce, tajemníkem obecního úřadu, místostarostou či místostarosty a starostou, který stojí v jeho čele;zaměstnanci obce zařazenými do obecního úřadu, tajemníkem obecního úřadu, je-li tato funkce zřízena, a starostou, který stojí v jeho čele;zaměstnanci obce zařazenými do obecního úřadu, tajemníkem obecního úřadu, je-li tato funkce zřízena, místostarostou či místostarosty a starostou, který stojí v jeho čele; C
Zvláštní orgán obce;zřizuje starosta v případech, které stanoví zvláštní zákony pro výkon přenesené působnosti, starosta současně jmenuje a odvolává jeho členy;zřizuje starosta nebo rada, a to pro zabezpečení působnosti obce, starosta současně jmenuje a odvolává jeho členy;zřizuje pouze zastupitelstvo v případech, které stanoví zákon a jen pro výkon samostatné působnosti, zastupitelstvo současně jmenuje a odvolává jeho členy; A
Místostarosta obce;je volen do funkce zastupitelstvem obce z řad členů zastupitelstva obce, za výkon své funkce odpovídá starostovi obce, nemusí být občanem České republiky a spolu s ostatními místostarosty podepisuje právní předpisy obce;je volen do funkce zastupitelstvem obce z řad členů zastupitelstva obce, za výkon své funkce odpovídá zastupitelstvu obce, musí být občanem České republiky a spolu se starostou podepisuje právní předpisy obce;je volen do funkce zastupitelstvem obce z řad členů zastupitelstva obce, za výkon své funkce odpovídá starostovi obce, nemusí být občanem České republiky a spolu se starostou podepisuje právní předpisy obce; B
Starostu v době jeho nepřítomnosti nebo v době, kdy starosta nevykonává funkci, zastupuje;místostarosta, kterého určí rada obce;místostarosta, kterého určí starosta obce;místostarosta, kterého určí zastupitelstvo obce; B
Starosta;zastupuje obec navenek, je volen zastupitelstvem obce z řad jeho členů, odpovídá za výkon své funkce zastupitelstvu obce a musí být občanem České republiky;je statutárním orgánem obce, je volen zastupitelstvem obce z řad jeho členů, odpovídá za výkon své funkce zastupitelstvu obce a nemusí být občanem České republiky;zastupuje obec navenek, je volen zastupitelstvem obce z řad jeho členů, přičemž za výkon své funkce nikomu nezodpovídá a musí být občanem České republiky; A
Do vyhrazené pravomoci rady obce mj. současně náleží;schvalovat organizační řád obecního úřadu, rozhodovat o uzavírání nájemních smluv a vydávat obecně závazné vyhlášky;rozhodovat ve věcech obce jako jediného společníka obchodní společnosti, zřizovat a zrušovat podle potřeby komise rady obce a schvalovat rozpočet obce;zabezpečovat hospodaření obce podle schváleného rozpočtu, provádět rozpočtová opatření v rozsahu stanoveném zastupitelstvem obce a vydávat nařízení obce; C
Rada obce;se může volit v každé obci, a to bez ohledu na počet členů zastupitelstva obce;se nevolí v obcích, kde je počet členů zastupitelstva obce nižší než 15;se volí pouze ve městech; B
Nesejde-li se zastupitelstvo obce;po dobu delší než 6 měsíců tak, aby bylo schopno se usnášet, Ministerstvo vnitra je rozpustí;po dobu delší než 3 měsíce tak, aby bylo schopno se usnášet, Ministerstvo vnitra je rozpustí;po dobu delší než 3 měsíce tak, aby bylo schopno se usnášet, oznámí neprodleně tuto skutečnost krajskému úřadu; A
V obci, kde se rada obce nevolí, vykonává její pravomoc;starosta obce, pokud zákon o obcích nestanoví jinak;pouze zastupitelstvo obce;pouze starosta obce; A
Zasedání zastupitelstva obce se koná;dle potřeby, nejméně však jednou ročně, svolává jej a zpravidla řídí nejstarší člen zastupitelstva obce, je veřejné a informaci o jeho konání podává obecní úřad vyvěšením na úřední desce obecního úřadu alespoň 7 dní před zasedáním;dle potřeby, nejméně však jednou za tři měsíce, svolává jej a zpravidla řídí starosta obce, je veřejné a informaci o jeho konání podává obecní úřad vyvěšením na úřední desce obecního úřadu alespoň 7 dní před zasedáním;dle potřeby, nejméně však jednou za tři měsíce, svolává jej a zpravidla řídí starosta obce, je neveřejné a informaci o jeho konání podává obecní úřad vyvěšením na úřední desce obecního úřadu alespoň 7 dní před zasedáním; B
Usnesení zastupitelstva obce je platné;při souhlasném vyjádření třípětinové většiny přítomných členů zastupitelstva obce;při souhlasném vyjádření nadpoloviční většiny všech členů zastupitelstva obce;při souhlasném vyjádření nadpoloviční většiny přítomných členů zastupitelstva obce; B
Do vyhrazené pravomoci zastupitelstva obce mj. současně náleží;stanovovat počet členů rady obce, volit z řad členů zastupitelstva obce starostu, místostarosty a další radní a odvolávat je z funkce a ukládat pokuty ve věcech samostatné působnosti obce;rozhodovat o založení a zrušení právnických osob, rozhodovat o vyhlášení místního referenda a zřizovat a zrušovat obecní policii;schvalovat rozpočet obce a závěrečný účet obce, schvalovat program rozvoje obce, stanovit celkový počet zaměstnanců obce v obecním úřadu a v organizačních složkách obce a rozhodovat o uzavírání nájemních smluv a smluv o výpůjčce; B
Právní předpisy obce vydává;zastupitelstvo obce – obecně závazné vyhlášky obce a bez ohledu na to, zda je zřízena rada obce, též i nařízení obce;zastupitelstvo obce – obecně závazné vyhlášky obce a rada obce nařízení obce, přičemž pokud není rada obce zřízena, vykonává tuto pravomoc starosta;zastupitelstvo obce – obecně závazné vyhlášky obce a rada obce nařízení obce, přičemž pokud není rada obce zřízena, vykonává tuto pravomoc zastupitelstvo obce; C
Zastupitelstvo obce je oprávněno, z náležitostí patřících do samostatné působnosti obce si vyhradit;veškeré pravomoci v samostatné působnosti obce bez ohledu na to, kterému orgánu svěřuje zákon příslušnou pravomoc, avšak vždy po předchozím souhlasu příslušného orgánu;pravomoci v samostatné působnosti obce s výjimkou pravomocí, které zákon vyhrazuje radě obce;veškeré pravomoci v samostatné působnosti obce bez jakékoliv výjimky; B
O záležitostech, které zákon svěřuje do vyhrazené pravomoci zastupitelstva obce, rozhoduje;pouze zastupitelstvo obce, přičemž žádnou z těchto pravomocí není oprávněno zastupitelstvo svěřit jinému orgánu obce;pouze zastupitelstvo obce, přičemž je oprávněno některou z těchto pravomocí svěřit radě obce;pouze zastupitelstvo obce, přičemž je oprávněno některou z těchto pravomocí svěřit některému z orgánů obce; A
Člen zastupitelstva obce je mj. povinen;zúčastňovat se zasedání zastupitelstva obce, popřípadě jiných zasedání jiných orgánů obce, je-li jejich členem;zúčastňovat se zasedání zastupitelstva obce, popřípadě i zasedání jiných orgánů obce, je-li jejich členem, a to minimálně 4 x ročně;zúčastňovat se zasedání zastupitelstva obce, popřípadě i zasedání jiných orgánů obce, přičemž mu nikdo není oprávněn ukládat úkoly; A
Člen zastupitelstva obce je při výkonu své funkce mj. oprávněn;požadovat od zaměstnanců obecního úřadu informace ve věcech, které souvisí s výkonem jejich funkce, přičemž informace musí být poskytnuta nejpozději do 60 dnů;požadovat od zaměstnanců obce zařazených do obecního úřadu, jakož i od zaměstnanců právnických osob, které obec založila nebo zřídila, informace ve věcech, které souvisí s výkonem jejich funkce, přičemž informace musí být poskytnuta nejpozději do 30 dnů;požadovat od zaměstnanců obce zařazených do obecního úřadu informace ve věcech, které souvisí s výkonem jejich funkce, přičemž informace musí být poskytnuta do 30 dnů, pokud však nadřízený příslušného zaměstnance nerozhodne jinak; B
Členům zastupitelstva obce, kteří byli pro výkon své funkce uvolněni,;musí být za stanovených podmínek poskytnuta za výkon funkce odměna, odměna se poskytuje měsíčně;musí být vždy vyplaceno odchodné při zániku mandátu člena zastupitelstva obce;musí být poskytnuta mimořádná odměna za splnění mimořádných nebo zvláště významných úkolů obce; A
Pokud obec vykonává samostatnou působnost, je při jejím výkonu vázána;při vydávání obecně závazných vyhlášek zákonem a v ostatních záležitostech též jinými právními předpisy vydanými na základě zákona a směrnicemi ministerstev a jiných ústředních správních úřadů;při vydávání obecně závazných vyhlášek zákonem a v ostatních záležitostech též jinými právními předpisy vydanými na základě zákona a závaznými pokyny krajského úřadu a Ministerstva vnitra;při vydávání obecně závazných vyhlášek zákonem a v ostatních záležitostech též jinými právními předpisy vydanými na základě zákona; C
Dvě nebo více obcí se mohou sloučit;na základě vzájemné dohody;na základě rozhodnutí krajského úřadu;na základě rozhodnutí Ministerstva vnitra; A
Místní referendum se musí vždy konat;při sloučení dvou či více obcí;při oddělení části obce, a to v té části obce, která se chce oddělit;při připojení obce k jiné obci, a to v obou obcích; B
Sloučení obcí, připojení obce, městských částí nebo městských obvodů nebo oddělení části obce lze provést jen;k počátku kalendářního roku nebo ke dni voleb do zastupitelstev v obcích;k počátku kalendářního roku;k počátku kalendářního roku následujícího po dni voleb do zastupitelstev v obcích; B
Mezi vyhrazené pravomoci zastupitelstva obce dle zákona o obcích nepatří:;plnění úkolů statutárního orgánu zaměstnavatele podle zvláštních právních předpisů vůči zaměstnancům obce zařazeným do obecního úřadu;"rozhodování o nabytí a převodu hmotných nemovitých věcí včetně vydání nemovitostí podle zvláštních zákonů, s výjimkou inženýrských sítí a pozemních komunikací; převodu bytů a nebytových prostorů z majetku obce";zřizování a rušení příspěvkových organizací a organizačních složek obce, schvalování jejich zřizovací listiny; A
Rozhodnutí orgánů městských obvodů a městských částí vydaná ve správním řízení přezkoumává;magistrát statutárního města, pokud tato působnost není svěřena zvláštnímu orgánu města nebo zvláštní zákon nestanoví jinak;pouze magistrát statutárního města;krajský úřad v přenesené působnosti, pokud zvláštní zákon nestanoví jinak; A
Území statutárních měst;lze členit na městské obvody nebo městské části;se musí vždy členit na městské obvody nebo městské části;nelze členit; A
Městské obvody a městské části územně členěných statutárních měst jednají za statutární město;pouze v záležitostech, které jim svěřuje zákon;v záležitostech jim svěřených zákonem a v mezích zákona statutem;v záležitostech, které si městské obvody a městské části územně členěných statutárních měst samy vyhradí; B
Městské obvody a městské části územně členěných statutárních měst;mohou vydávat pouze nařízení, pokud jim tuto pravomoc statutární město svěří;mohou vydávat právní předpisy obce;nemohou vydávat právní předpisy obce; C
Územně členěná statutární města;své vnitřní poměry ve věcech správy města upraví statutem, který je vydáván formou usnesení zastupitelstva města;své vnitřní poměry ve věcech správy města upraví statutem, který je vydáván formou obecně závazné vyhlášky obce;své vnitřní poměry ve věcech správy města upraví statutem, přičemž formu vydání statutu zákon nestanoví; B
Územně členěná statutární města své vnitřní poměry ve věcech správy města upraví;ve Věstníku statutárního města;statutem;usnesením rady města; B
Výčet obcí s pověřeným obecním úřadem a obcí s rozšířenou působností;stanoví zákon o obcích, přičemž jejich správní obvody, které jsou vymezeny územím obcí, stanoví vyhláška;stanoví zvláštní zákon, přičemž jejich správní obvody, které jsou vymezeny územím okresů, stanoví vyhláška;stanoví zvláštní zákony, přičemž jejich správní obvody, které jsou vymezeny územím obcí, popř. vojenských újezdů, stanoví prováděcí vyhlášky; C
Subjekty, které jsou oprávněné vydávat prováděcí právní předpisy, jsou:;pouze ministerstva, jiné správní úřady a územní samosprávné celky;pouze vláda, ministerstva a územní samosprávné celky;vláda, ministerstva, jiné správní úřady a územní samosprávné celky; C
Povinnými subjekty, které mají podle zákona o svobodném přístupu k informacím povinnost poskytovat informace vztahující se k jejich působnosti, jsou;pouze státní orgány a územní samosprávné celky;pouze státní orgány a územní samosprávné celky, jde-li o informace týkající se výkonu přenesené působnosti;státní orgány, územní samosprávné celky a jejich orgány a veřejné instituce; C
V místním referendu se rozhoduje;o záležitostech, které patří do samostatné působnosti obce;o věcech, které patří do přenesené působnosti obce;o věcech, které patří do samostatné působnosti obce nebo kraje; A
Veřejnou správu tvoří;státní správa a samospráva;pouze ústřední státní správa a samospráva;pouze státní správa; A
