question;option1;option2;option3;correct
Ústřední úroveň státní správy je představována;pouze ministerstvy;ministerstvy, Parlamentem České republiky a Nejvyšším správním soudem;ministerstvy a jinými ústředními správními úřady; C
Dnem účinnosti právního předpisu je;den jeho schválení Parlamentem České republiky;den jeho vyhlášení ve Sbírce zákonů;den, od něhož právní předpis zakládá, mění nebo ruší právní vztahy; C
Referendum podle zákona o místním referendu lze konat:;o věcech, které patří do samostatné a přenesené působnosti obce nebo statutárního města;o věcech, které patří do samostatné působnosti obce nebo statutárního města;o zřízení nebo zrušení orgánů obce nebo statutárního města a o jejich vnitřním uspořádání a o schválení, změně nebo zrušení obecně závazné vyhlášky obce; B
Správními činnostmi se pro účely zákona o úřednících územních samosprávných celků rozumí;plnění úkolů v samostatné nebo přenesené působnosti územního samosprávného celku podle zvláštních právních předpisů;plnění úkolů v přenesené působnosti územního samosprávného celku podle zvláštních právních předpisů;plnění úkolů v samostatné nebo přenesené působnosti vymezených vyhláškou Ministerstva vnitra; A
Správní činnosti stanovené prováděcím právním předpisem zajišťuje územní samosprávný celek prostřednictvím úředníků, kteří prokázali zvláštní odbornou způsobilost. Výjimečně tyto činnosti může vykonávat i úředník, který nemá zvláštní odbornou způsobilost,;nejdéle však po dobu 18 měsíců od vzniku pracovního poměru úředníka k územnímu samosprávnému celku nebo ode dne, kdy začal vykonávat činnost, pro jejíž výkon je prokázání zvláštní odborné způsobilosti předpokladem;nejdéle však po dobu 6 měsíců od vzniku pracovního poměru úředníka k územnímu samosprávnému celku nebo ode dne, kdy začal vykonávat činnost, pro jejíž výkon je prokázání zvláštní odborné způsobilosti předpokladem;nejdéle však po dobu 12 měsíců od vzniku pracovního poměru úředníka k územnímu samosprávnému celku nebo ode dne, kdy začal vykonávat činnost, pro jejíž výkon je prokázání zvláštní odborné způsobilosti předpokladem; A
Dnem platnosti právního předpisu je;den jeho vyhlášení;den jeho schválení Parlamentem České republiky;den, od něhož právní předpis zakládá, mění nebo ruší právní vztahy; A
Ve Sbírce právních předpisů územních samosprávných celků a některých správních úřadů se vedle právních předpisů územních samosprávných celků zveřejňují i;nařízení vlády;některé akty, které vznikají při výkonu působnosti územních samosprávných celků nebo v souvislosti s tímto výkonem;právní předpisy vydávané ministerstvy; B
Územní samosprávné celky jsou;městské části a obvody statutárních měst a svazky obcí a krajů;obce, města, městské části a kraje;územní společenství občanů, která mají právo na samosprávu; C
Ke změně názvu obce dává souhlas:;Ministerstvo vnitra na návrh obce;krajský úřad na návrh starosty obce;soud na základě žádosti podepsané nadpoloviční většinou všech členů zastupitelstva obce; A
Vláda je oprávněna vydávat nařízení;na základě zákona a v jeho mezích, jen je-li k tomu zákonem zmocněna;k provedení zákona a v jeho mezích;"na základě zákona a v jeho mezích; tato nařízení jsou závazná jen pro územní samosprávné celky"; B
Právo obcí na samosprávu garantuje;zákon o zřízení ministerstev a jiných ústředních orgánů státní správy České republiky;Ústava;Listina základních práv a svobod; B
Ministerstva, jiné správní úřady a orgány územní samosprávy mohou vydávat právní předpisy;v mezích své působnosti, je-li to potřebné;na základě a v mezích zákona, jsou-li k tomu zákonem zmocněny;na základě a v mezích zákona; B
Ministerstva a jiné správní úřady lze zřídit a jejich působnost stanovit;zákonem a v zákonem stanovených případech též nařízením vlády;pouze ústavním zákonem;pouze zákonem; C
Působnost zastupitelstev územních samosprávných celků;lze stanovit zákonem nebo na jeho základě vydaným prováděcím právním předpisem;lze stanovit jen ústavním zákonem;lze stanovit jen zákonem; C
Právo být volen do zastupitelstva kraje má za podmínek stanovených zvláštním zákonem;občan kraje, který dosáhl věku 18 let a vlastní na území obce nemovitost;občan České republiky, který dosáhl věku 18 let a je přihlášen k trvalému pobytu v některé obci v územním obvodu kraje;občan kraje, který dosáhl věku 18 let a dále fyzická osoba, která dosáhla věku 18 let a vlastní na území obce nemovitost; A
Platné a účinné právní předpisy obcí vydané před 1. 1. 2022;musí být zveřejněny ve Sbírce právních předpisů územních samosprávných celků a některých správních úřadů nejpozději do 3 let ode dne nabytí účinnosti zákona o Sbírce právních předpisů územních samosprávných celků a některých správních úřadů, jinak pozbývají platnosti;nemusí být zveřejněny ve Sbírce právních předpisů územních samosprávných celků a některých správních úřadů;musí být zveřejněny ve Sbírce právních předpisů územních samosprávných celků a některých správních úřadů nejpozději do 10 let ode dne nabytí účinnosti zákona o Sbírce právních předpisů územních samosprávných celků a některých správních úřadů, jinak pozbývají platnosti; A
Státní moc lze uplatňovat jen;v případech stanovených ústavním zákonem nebo mezinárodní smlouvou;v případech, v mezích a způsoby, které stanoví zákon;v případech stanovených zákonem nebo prováděcím právním předpisem; B
Přijaté zákony podepisuje:;prezident republiky, předseda vlády a předseda Senátu;předseda vlády, předseda Poslanecké sněmovny a prezident republiky;předseda Poslanecké sněmovny, předseda Senátu a předseda vlády; B
Právo podat návrh zákona má podle Ústavy České republiky:;poslanec, skupina poslanců, Senát, vláda nebo zastupitelstvo vyššího územního samosprávného celku;Poslanecká sněmovna, Senátor, vláda nebo legislativní rady vlády;každý občan, který má právo volit, musí tak ovšem učinit prostřednictvím poslance, který má poslanecký obvod v místě trvalého bydliště navrhovatele zákona; A
Prezident republiky:;má právo vrátit každý přijatý zákon;musí podepsat každý zákon, který přijala Poslanecká sněmovna a Senát;má právo vrátit Parlamentu přijatý zákon s výjimkou zákona ústavního; C
Územní samosprávu vykonávají:;obce, kraje a hlavní město Praha;obce, kraje, hlavní město Praha, Asociace krajů a Svaz měst a obcí ČR;obecní a krajské úřady; A
Základní lhůta pro vyřízení žádosti o informace podle zákona č. 106/1999 Sb. činí:;15 dnů;30 dnů;bezodkladně, nejpozději však do 30 dnů ode dne doručení žádosti k nimž je možno připočíst dalších 30 dnů, pokud je třeba žadatele předvolat, nařídit ústní jednání, šetření, ohledání apod.; A
Neposkytne-li povinný subjekt informaci, protože ji nemá a mít nemusí:;vydá rozhodnutí o odmítnutí žádosti, které musí splňovat náležitosti správního rozhodnutí;odkáže žadatele na orgán, který informací disponuje a jde-li o orgán veřejné moci, postoupí tomuto orgánu žádost usnesením;řízení o žádosti přeruší a předá věc nadřízenému orgánu k rozhodnutí s odůvodněním, že informace nemá a mít nemusí; A
Žadatelem o informaci podle zákona č. 106/1999 Sb. o svobodném přístupu k informacím je:;pouze fyzická osoba – plně svéprávný občan České republiky;fyzická i právnická osoba;každá fyzická osoba, která prokáže právní zájem na poskytnutí informace; B
Povinný subjekt:;má právo požadovat za poskytnutí informací úhradu;je povinen poskytovat informace bezplatně;má právo požadovat úhradu pouze za poskytnutí utajovaných informací; A
Osobním údajem se rozumí:;jméno, příjmení a rodné číslo;jméno nebo jména, příjmení, rodné číslo a adresa pobytu uvedena v evidenci osob;jakékoli informace, které se týkají identifikované nebo identifikovatelné žijící osoby; C
Subjektem údajů se rozumí:;fyzická osoba, k níž se osobní údaje vztahují;úřad, který, byť jeden osobní údaj zpracovává;stát jako nositel pravomoci vést osobní údaje o každém občanu; A
Opravnými prostředky podle zákona č. 106/1999 Sb. o svobodném přístupu k informacím jsou:;odvolání a stížnost;odvolání a rozklad;stížnost a rozklad; A
Je-li nařízení rady obce v rozporu se zákonem,;příslušný krajský úřad vyzve radu obce k nápravě;Ministerstvo vnitra pozastaví jeho účinnost;rozhodne o jeho platném znění zastupitelstvo příslušné obce; A
Ministerstvo vnitra může pozastavit účinnost obecně závazné vyhlášky obce bez předchozí výzvy ke zjednání nápravy;odporuje-li obecně závazná vyhláška obce zákonu a vyhlášce ministerstva;odporuje-li obecně závazná vyhláška obce zákonu a nařízení vlády;v případě zřejmého rozporu s lidskými právy a základními svobodami; C
Odporuje-li obecně závazná vyhláška obce zákonu,;vyzve krajský úřad obec ke zjednání nápravy;pozastaví krajský úřad její účinnost bez předchozí výzvy ke zjednání nápravy;vyzve Ministerstvo vnitra obec ke zjednání nápravy; C
Odporuje-li nařízení obce zákonu nebo jinému právnímu předpisu,;vyzve krajský úřad obec ke zjednání nápravy;zruší krajský úřad toto nařízení bez předchozí výzvy ke zjednání nápravy;vyzve Ministerstvo vnitra obec ke zjednání nápravy; A
Funkce starosty je neslučitelná;s funkcí člena kontrolního výboru dané obce;s výkonem mandátu poslance či senátora;s výkonem mandátu zastupitele kraje; A
Funkce člena zastupitelstva kraje je neslučitelná;s funkcí vykonávanou na ministerstvu, jiném ústředním orgánu státní správy nebo na orgánu státní správy s celostátní působností, obsazovanou volbou, jmenováním nebo ustanovováním;s funkcí člena zastupitelstva obce, která leží na území příslušného kraje;s funkcí starosty obce, která leží na území příslušného kraje; A
Odvoláním starosty z funkce;zaniká automaticky též jeho mandát zastupitele;přestává být členem rady;dochází k odvolání celé rady; B
V obcích, kde se rada obce nezřizuje, vykonává její pravomoci:;starosta;zákonem stanovené kompetence přecházejí na starostu a tajemníka;v zákonem stanovených případech zastupitelstvo obce a starosta; C
Mandát zastupitele zaniká:;nesejde-li se zastupitelstvo po dobu delší než 6 měsíců;ztrátou volitelnosti;k 31. 12. kalendářního roku, v němž dosáhl věku 70 let; B
Tajemník obce:;je ze své funkce nezávislý, podléhá odvolání ředitelem krajského úřadu;je ze své funkce odpovědný starostovi;je ze své funkce odvolán ředitelem krajského úřadu po předchozím projednání zastupitelstva příslušné obce; B
Úředníkem obce je:;zaměstnanec obce;starosta, místostarosta a hejtman;zaměstnanec obce podílející se na výkonu správních činností zařazený do obecního úřadu; C
Úředníkem obce je;tajemník obecního úřadu;starosta obce;vždy každý zaměstnanec obce; A
Tajemník úřadu městského obvodu nebo úřadu městské části;je jmenován a odvoláván starostou městského obvodu nebo městské části, a to se souhlasem ředitele krajského úřadu, přičemž bez tohoto souhlasu je jmenování a odvolání tajemníka úřadu městského obvodu nebo úřadu městské části neplatné;je jmenován a odvoláván primátorem statutárního města, a to se souhlasem tajemníka magistrátu statutárního města, přičemž bez tohoto souhlasu je jmenování a odvolání tajemníka úřadu městského obvodu nebo úřadu městské části neplatné;je jmenován a odvoláván starostou městského obvodu nebo městské části, a to se souhlasem tajemníka magistrátu statutárního města, přičemž bez tohoto souhlasu je jmenování a odvolání tajemníka úřadu městského obvodu nebo úřadu městské části neplatné; C
Komise rady obce;je orgánem obce, odpovídá za svou činnost radě obce;je orgánem rady obce, odpovídá za veškerou svou činnost zastupitelstvu obce;je orgánem rady obce, odpovídá za svou činnost radě obce; C
Předsedou komise rady obce, které byl svěřen výkon přenesené působnosti, může být jen;osoba, která, nestanoví-li zvláštní zákon jinak, prokázala zvláštní odbornou způsobilost v oblasti komisi svěřené přenesené působnosti;osoba s vysokoškolským vzděláním příslušného směru;starosta nebo místostarosta obce; A
Zastupitelstvo obce zřizuje vždy;finanční výbor, kontrolní výbor a výbor pro výchovu a vzdělávání;finanční výbor, kontrolní výbor a školský výbor;finanční výbor a kontrolní výbor; C
Výbor zastupitelstva obce;je orgánem obce;je orgánem zastupitelstva obce;je orgánem rady obce; B
Zřízení odborů a počet zaměstnanců obecního úřadu podléhá souhlasu;rady obce;zastupitelstvu obce;starosty, po předchozím projednání s odborovou organizací; A
Členem kontrolního výboru nemůže být;ten, kdo nesplňuje zákonem stanovené požadavky spočívající v uznatelnosti vzdělání nebo úspěšném absolvování zkoušky odborné způsobilosti;starosta;zastupitel; B
Předsedou kontrolního výboru může být jen;zastupitel;osoba splňující zákonem stanovené požadavky v oboru práva a kontroly;osoba splňující zákonem stanovené požadavky v oboru práva a kontroly a prokáže-li souvislou praxi v těchto oborech po dobu nejméně 5 let; A
Pracovní poměr úředníka upravuje:;zákon č. 312/2002 Sb. o úřednících a zákon č. 262/2006 Sb., zákoník práce;zákon č. 234/2014 Sb. o státní službě;zákon č. 262/2006 Sb., zákoník práce; A
Úřední osoba je;osoba bezprostředně se podílející na výkonu pravomoci správního orgánu;každý zaměstnanec obce;každý zaměstnanec obce vyjma osoby stojící v čele příspěvkové organizace zřízené obcí; A
Oprávněná úřední osoba je;osoba bezprostředně se podílející na výkonu pravomoci správního orgánu;úřední osoba oprávněná k provádění úkonů správního orgánů podle vnitřních předpisů správního orgánu nebo pověřená vedoucím správního orgánu;zaměstnanec obce včetně zaměstnanců příspěvkových organizací; B
Účastník řízení může namítat podjatost:;"jakmile se o ní dozví; pokud ji neuplatní bez zbytečného odkladu, k námitce se nepřihlédne";do 30 dnů ode dne kdy se o ní dozvěděl;do 15 dnů ode dne oznámení rozhodnutí, nejpozději do vydání rozhodnutí odvolacího orgánu ve věci; A
O námitce podjatosti úřední osoby rozhodne:;služebně nadřízený úřední osoby, vůči níž námitka podjatosti směřuje;tajemník z funkce nadřízeného všem úředníkům a plnící funkci zaměstnavatele;nadřízený správní orgán; A
Následkem vyloučení úřední osoby pro pochybnost o její nepodjatosti může být:;delegace věci nadřízenému orgánu;zastavení řízení;atrakce nadřízeným orgánem;A
O námitce podjatosti se rozhoduje:;usnesením;rozhodnutím;opatřením obecné povahy, jde-li o vyloučení vše úředních osob správního orgánu; A
Pro nahlížení do správního spisu se užije právní úpravy zakotvené v zákonu:;č. 106/1999 Sb.;č. 500/2004 Sb.;podle kterého se vede řízení; B
Veřejnoprávní smlouvu nemůže uzavřít:;obec s právnickou či fyzickou osobou;obec s jinou obcí;obecní úřad obce základního typu s obecním úřadem obce s rozšířenou působností; C
V souladu se zásadou součinnosti by měl správní orgán;"přispět ke smírnému řešení věci; to platí pouze v řízeních o správním deliktu";uvědomit dotčené osoby o úkonu, který hodlá učinit, s dostatečným předstihem za předpokladu, že je to potřebné k hájení jejich práv a neohrozí-li to účel úkonu;umožnit dotčeným osobám realizaci jejich procesních práv, pokud to neohrozí rychlost a hospodárnost řízení; B
Ze zásady součinnosti s účastníky vyplývá, že správní orgán v souvislosti se svým úkonem;musí poskytnout účastníkovi řízení poučení o jeho právech a povinnostech v písemné podobě;nesmí poskytnout účastníkovi řízení žádné nadbytečné informace;poskytne dotčené osobě přiměřené poučení o jejích právech a povinnostech; C
Z principu dobré správy mimo jiné vyplývá, že každý, kdo plní úkoly vyplývající z působnosti správního orgánu,;má povinnost se k dotčeným osobám chovat zdvořile a podle možností jim vycházet vstříc;musí v případě podezření z nezdvořilého chování vždy k úkonu přizvat nestrannou osobu;je ve svém rozhodování nezávislý a nesmí být vázán žádnými příkazy; A
Nevyplývá-li ze zákona něco jiného, postupuje správní orgán vždy tak, aby;byl zjištěn stav věci, o němž nejsou důvodné pochybnosti, v rozsahu, který je nezbytný pro soulad jeho úkonu se základními zásadami řízení uvedenými v § 2 správního řádu;byl zjištěn úplně a objektivně skutečný stav věci;nebylo možné důvodně pochybovat o nezaujatosti účastníků řízení; A
Co znamená „subsidiární“ použití správního řádu?;správní řád se použije tehdy, pokud zvláštní předpis neupravuje jiný postup;zvláštní právní předpis vždy doplňuje závaznou úpravu ve správním řádu;je možné si vybrat, zda bude použita úprava ve správním řádu nebo ve zvláštním zákoně; A
Správní orgán;zastaví řízení, pokud z podkladů zjistí, že žádosti nelze vyhovět;"v zákonem stanovených případech řízení zastaví; usnesením o zastavení řízení se řízení končí";řízení rozhodnutím zastaví, pokud je účastník neznámého pobytu nebo sídla; B
Řízení o žádosti se zastavuje;rozhodnutím;usnesením;usnesením, které se poznamená do spisu; B
Řízení z moci úřední se zastavuje;rozhodnutím;usnesením;usnesením, které se poznamená do spisu; C
Spojit různá řízení lze,;pokud se týkají téhož předmětu nebo spolu jinak věcně souvisejí;pokud s tím souhlasí dotčené osoby;pouze pokud by je vedla jedna oprávněná úřední osoba; A
Po dobu přerušení řízení;nesmí správní orgán až do odpadnutí důvodu pro přerušení provádět žádné úkony v řízení vyjma ukládání pořádkové pokuty;správní orgán nejedná s účastníkem, u něhož nastal důvod pro přerušení, s ostatními účastníky pokračuje v řízení;neběží lhůty týkající se provádění úkonů včetně lhůty pro vydání rozhodnutí; C
Správní orgán může řízení přerušit;"na požádání žadatele nebo na návrh dotčeného správního orgánu; o přerušení řízení musí vydat rozhodnutí";pokud nastal některý ze zákonem stanovených důvodů pro přerušení řízení, o přerušení řízení vydá usnesení;"pokud z důvodu dokazování hrozí vydání opatření proti nečinnosti; o přerušení rozhodne usnesením"; B
Zajišťovací prostředky;pomáhají správnímu orgánu zajistit průběh a účel řízení;pomáhají účastníkům řízení;zajišťují sporný majetek při exekuci; A
Pořádková pokuta;je donucovacím prostředkem k vymožení splnění rozhodnutím uložené peněžité povinnosti;se ukládá rozhodnutím ve výši až 50 000,- Kč, a to i opakovaně;se ukládá také za neuposlechnutí příkazu úřední osoby, pokud tím byla snížena důstojnost této osoby; B
Správní orgán předběžným opatřením;může zajistit věc, která poslouží jako důkaz v řízení, o tomto zajištění sepíše úřední záznam;"může zatímně upravit poměry účastníků; předběžné opatření nařídí rozhodnutím";zajistí pozdější provedení exekuce, vydá o tom usnesení; B
Správní orgán předvolá;osobu, jejíž osobní účast při úkonu v řízení je k provedení úkonu nutná;každou osobu, které se úkon v řízení týká;účastníka řízení za podmínky, že výslech svědka bude proveden mimo ústní jednání; A
Správní orgán může nechat předvést;kohokoli, kdo se na předvolání nedostaví ke správnímu orgánu;účastníka nebo svědka, pokud se bez náležité omluvy na předvolání nedostaví ke správnímu orgánu;znalce nebo účastníka, pokud je jeho výslech potřebný a on se nedostavil ani po opakovaném předvolání; B
Pokud se předvolaná osoba bez náležité omluvy nebo bez dostatečných důvodů na předvolání nedostaví, správní orgán může vydat usnesení, na jehož základě bude předveden;kdokoli;účastník nebo svědek;účastník, jeho zástupce, svědek nebo znalec; B
Předvedení na požádání správního orgánu zajišťuje;"Policie České republiky nebo jiný ozbrojený sbor, o němž to stanoví zvláštní zákon; v řízení před orgány obcí zajišťuje předvedení také obecní policie";pouze Policie České republiky nebo jiný ozbrojený sbor;pouze Policie České republiky a v řízení před orgány obcí také obecní policie; A
Správní orgán může uložit pořádkovou pokutu;tomu, kdo se bez omluvy nedostaví na předvolání ke správnímu orgánu, navzdory předchozímu napomenutí ruší pořádek nebo neuposlechne pokynu úřední osoby;tomu, kdo v řízení závažně ztěžuje jeho postup nebo tomu, kdo učiní hrubě urážlivé podání;tomu, kdo v řízení závažně ztěžuje jeho postup tím, že se bez omluvy nedostaví na předvolání ke správnímu orgánu, navzdory předchozímu napomenutí ruší pořádek nebo neuposlechne pokynu úřední osoby anebo tomu, kdo učiní hrubě urážlivé podání; C
Probíhá-li řízení o předběžné otázce, správní orgán;řízení přeruší, pokud s tím souhlasí dotčený orgán;řízení zastaví;může řízení přerušit; C
Stav, kdy lhůty pro vydání rozhodnutí neběží, se nazývá;přerušení řízení;pozastavení řízení;překážka v řízení; A
Jako svědek nemůže v řízení vystupovat;osoba blízká účastníku řízení, pokud by v důsledku toho hrozilo stíhání pro delikt účastníkovi nebo této osobě;přizvaná osoba, která se účastnila úkonu v řízení;účastník řízení; C
K provedení důkazů lze užít;"listin, svědecké výpovědi nebo znaleckého posudku; jako svědek nesmí vystupovat osoba blízká účastníkovi řízení";všech důkazních prostředků, které jsou vhodné ke zjištění stavu věci a které nejsou získány nebo provedeny v rozporu s právními předpisy;listin, ohledání, svědecké výpovědi nebo znaleckého posudku, jakýkoliv důkaz lze nahradit čestným prohlášením, pokud to umožní správní orgán; B
Podklady pro vydání rozhodnutí opatřuje;správní orgán, lze však připustit, aby je obstaral účastník, který o to požádá;výhradně správní orgán, podklady opatřené dotčenou osobou nelze v řízení použít;účastník řízení uvedený v § 27 odst. 1, v případě potřeby též správní orgán; A
Podkladem pro vydání rozhodnutí;jsou výhradně důkazy, skutečnosti známé správnímu orgánu z úřední činnosti a podklady od jiných správních orgánů nebo orgánů veřejné moci;je cokoli, co pomůže správnímu orgánu zjistit stav věci, o němž nejsou důvodné pochybnosti, zejména návrhy účastníků, důkazy, skutečnosti známé správnímu orgánu z úřední činnosti, podklady od jiných správních orgánů nebo orgánů veřejné moci, jakož i skutečnosti obecně známé;"je cokoli, co pomůže správnímu orgánu zjistit stav věci, o němž nejsou důvodné pochybnosti, zejména důkazy, skutečnosti známé správnímu orgánu z úřední činnosti, podklady od jiných správních orgánů nebo orgánů veřejné moci, jakož i skutečnosti obecně známé; návrhy účastníků ale podkladem pro rozhodnutí nejsou"; B
Správní orgán hodnotí podklady, zejména důkazy;vždy podle své úvahy, přitom pečlivě přihlíží ke všemu, co vyšlo v řízení najevo, včetně toho, co uvedli účastníci;podle své úvahy, pokud zákon nestanoví, že některý podklad je pro správní orgán závazný, přitom pečlivě přihlíží ke všemu, co vyšlo v řízení najevo, včetně toho, co uvedli účastníci;podle své úvahy, pokud zákon nestanoví, že některý podklad je pro správní orgán závazný, přitom pečlivě přihlíží ke všemu, co vyšlo v řízení najevo, ale nebere v potaz to, co uvedli účastníci, protože návrhy účastníků nejsou podkladem rozhodnutí; B
Pro správní orgán jsou závazné tyto podklady pro rozhodnutí:;pravomocně vyřešená předběžná otázka, obsah veřejné listiny a závazné stanovisko jiného správního orgánu;"obsah veřejné listiny a závazné stanovisko jiného správního orgánu; o pravomocně vyřešené předběžné otázce si může správní orgán učinit vlastní úsudek";"pravomocně vyřešená předběžná otázka a závazné stanovisko jiného správního orgánu; veřejná listina není podkladem pro rozhodnutí"; A
