question;option1;option2;option3;correct
Státní moc lze upltňovt jen;v případech stanovených ústavním zákonem nebo mezinárodní smlouvou;v případech, v mezích a způsoby, které stanoví zákon;v případech stanovených zákonem nebo prováděcím předpisem; B
Ministerstva lze charakterizovat jako:;správní orgány s územní působností;ústřední správní orgány s všeobecnou působností;ústřední správní orgány s dílčí věcnou působností; C
Samosprávu rozdělujeme na samosprávu:;dílčí a obecnou;územní a zájmovou;územní a ústřední; B
V České republice se uplatňuje model veřejné správy, který nazýváme:;angloamerický systém;francouzský systém;smíšený systém; C
Vrcholným orgánem výkonné moci v České republice je:;prezident ČR;parlament ČR;vláda ČR; C
Právo na právní pomoc v řízení před soudy, jinými státními orgány či orgány veřejné správy podle Listiny základních práv a svobod:;má každý, za podmínky, že se na něj nevztahuje právo odepřít výpověď;náleží pouze státnímu občanu České republiky a osobě bez státní příslušnosti s trvalým pobytem na území České republiky;má každý; C
Listina základních práv a svobod upravuje v čl. 3 rozhodování o národnosti. Při tom stanoví, že:;každý rodič má právo svobodně rozhodovat o národnosti svého dítěte.;každý má právo svobodně rozhodovat o své národnosti.;občan má právo svobodně rozhodovat o své národnosti; B
Která z těchto územních jednotek není podle zákona o územně správním členění státu vytvořena?;okres Brno-město;okres Praha-město;okres Plzeň-město; B
Území vojenského újezdu je vymezeno:;pomocí katastrálních území;pomocí obcí;pomocí částí obcí; A
Ve výkonu petičního práva:;může být přiměřenými omezeními bráněno osobám, které nemají občanství Evropské unie;nesmí být nikomu bráněno;může být přiměřenými omezeními bráněno osobám, které nemají občanství České republiky; B
V širším pojetí členíme veřejnou správu následně:;moc zákonodárná, výkonná a soudní;státní správa, územní samospráva, zájmová samospráva;část mocenská, ochranná a organizační; B
Nařízení vlády a vyhlášky smí být vydány;k doplnění zákona, uloží-li to ministerstvům soud;k provedení zákona a v jeho mezích, přičemž smí upravovat jakékoliv záležitosti;k provedení zákona a v jeho mezích, přičemž nesmí upravovat věci vyhrazené zákonu; C
Vyberte nepravdivé tvrzení:;Nejvyšší kontrolní úřad podléhá kontrole České národní banky.;Veřejný ochránce práv nemá k dispozici žádné sankční ani přímé donucovací prostředky.;Úřad pro ochranu osobních údajů je nezávislý na výkonné moci.; A
Vyberte pravdivé tvrzení:;Ústava ČR může být doplňována či měněna zákony a podzákonnými právními předpisy;součástí ústavního pořádku ČR je Listina základních práv a svobod.;ve výjimečných případech stanovených zákonem může být jedna osoba současně členem obou komor Parlamentu.; B
Návrh na zrušení jiného právního předpisu nebo jeho jednotlivých ustanovení není oprávněn podat:;Prezident republiky;Veřejný ochránce práv;Senát Ústavního soudu v souvislosti s rozhodováním o ústavní stížnosti; A
Pokud zvláštní zákon upravuje působnost hlavního města Prahy a nestanoví, zda jde o samostatnou či přenesenou působnost,;jde vždy o činnosti patřící do samostatné působnosti hlavního města Prahy;jde podle povahy dané věci o samostatnou nebo o přenesenou působnost hlavního města Prahy;jde vždy o činnosti patřící do přenesené působnosti hlavního města Prahy; A
Stanoví-li zákon, že určitá věc náleží do působnosti kraje,;jedná se o výkon samostatné působnosti, rozhodne-li tak krajský úřad;jedná se vždy o výkon přenesené působnosti, i když to zákon výslovně nestanoví;jedná se o výkon samostatné působnosti, pokud zákon nestanoví, že jde o výkon přenesené působnosti; C
Pokud orgány krajů vykonávají státní správu, jedná se o jejich;samostatnou působnost;smíšenou působnost;přenesenou působnost; C
Rozsah výkonu přenesené působnosti orgánů krajů stanoví;zákon o krajích a zvláštní zákony;zákon o obcích;zákon o správním řízení; A
Rozhodnutí orgánů hlavního města Prahy vydaná ve správním řízení přezkoumává;Úřad vlády České republiky;příslušné ministerstvo nebo jiný ústřední správní úřad, do jehož působnosti náleží daná oblast přenesené působnosti hlavního města Prahy;Ministerstvo vnitra; B
Při výkonu přenesené působnosti je hlavní město Praha;podřízeno vládě;podřízeno Ministerstvu vnitra;podřízeno příslušnému ministerstvu; C
Tajemník úřadu městské části hlavního města Prahy je za plnění uložených úkolů odpovědný;v oblasti samostatné působnosti starostovi a v oblasti přenesené působnosti řediteli Magistrátu hlavního města Prahy;v oblasti přenesené působnosti starostovi a v oblasti samostatné působnosti radě městské části a starostovi;starostovi městské části hlavního města Prahy; C
Úřad městské části hlavního města Prahy tvoří;tajemník úřadu městské části a další zaměstnanci městské části zařazení do úřadu městské části;starosta, zástupce (zástupci) starosty, tajemník úřadu městské části, je-li tato funkce zřízena, a zaměstnanci městské části zařazení do úřadu městské části;starosta a další členové rady městské části, tajemník úřadu městské části a další zaměstnanci městské části zařazení do úřadu městské části; B
Zastupitelstvo městské části hlavního města Prahy zřizuje vždy;výbor kontrolní a výbor finanční;výbor kontrolní, výbor finanční a výbor pro národnostní menšiny;výbor kontrolní, výbor finanční a výbor pro výchovu a vzdělávání; A
Starosta městské části hlavního města Prahy pozastaví výkon usnesení rady městské části hlavního města Prahy;má-li za to, že je nesprávné;má-li za to, že je v rozporu s právním předpisem nebo usnesením zastupitelstva městské části;má-li za to, že je v rozporu se zákonem nebo jiným právním předpisem; A
Starosta městské části hlavního města Prahy;jmenuje a odvolává tajemníka úřadu městské části po předchozím souhlasu rady městské části nebo zastupitelstva městské části tam, kde se rada městské části nevolí;jmenuje a odvolává tajemníka úřadu městské části po předchozím souhlasu ředitele Magistrátu hlavního města Prahy;jmenuje a odvolává tajemníka úřadu městské části po předchozím souhlasu primátora hlavního města Prahy; B
K platnému usnesení rady městské části hlavního města Prahy je třeba;souhlasu nejméně jedné třetiny všech jejích členů;souhlasu nadpoloviční většiny přítomných, je-li přítomna více než polovina všech jejích členů;souhlasu nadpoloviční většiny všech jejích členů; C
Ředitel Magistrátu hlavního města Prahy;hlasuje na zasedání zastupitelstva hlavního města Prahy, pokud je o účast na zasedání požádán;není oprávněn se zúčastnit zasedání zastupitelstva hlavního města Prahy;zúčastňuje se zasedání zastupitelstva a rady hlavního města Prahy s hlasem poradním; C
V čele Magistrátu hlavního města Prahy je;primátor hlavního města Prahy;primátor hlavního města Prahy nebo jiný člen zastupitelstva hlavního města Prahy určený zastupitelstvem;ředitel Magistrátu; C
Ředitel Magistrátu hlavního města Prahy nesmí;vyvíjet činnost ve prospěch politických stran nebo politických hnutí;být členem politické strany ani politického hnutí;vykonávat funkce v politických stranách a politických hnutích; C
Kontrolní výbor zastupitelstva hlavního města Prahy;provádí kontrolu hospodaření s majetkem a finančními prostředky hlavního města Prahy;kontroluje plnění usnesení zastupitelstva a rady hlavního města Prahy;provádí kontrolu hospodaření městských částí v rozsahu a za podmínek stanovených Statutem hlavního města Prahy; B
Magistrát hlavního města Prahy tvoří;primátor hlavního města Prahy, ředitel Magistrátu a další zaměstnanci hlavního města Prahy zařazení do tohoto orgánu;primátor hlavního města Prahy, náměstci primátora hlavního města Prahy, ředitel Magistrátu a další zaměstnanci hlavního města Prahy zařazení do tohoto orgánu;ředitel Magistrátu a další zaměstnanci hlavního města Prahy zařazení do tohoto orgánu; C
Zastupitelstvo hlavního města Prahy je povinno zřídit vždy;výbor finanční, výbor kontrolní a výbor pro výchovu a vzdělávání;výbor finanční, výbor kontrolní, výbor pro výchovu a vzdělávání a výbor pro národnostní menšiny;výbor finanční a výbor kontrolní; A
Primátor hlavního města Prahy jmenuje a odvolává ředitele Magistrátu hlavního města Prahy;po předchozím souhlasu ministra vnitra;na návrh ministra vnitra;po předchozím souhlasu rady hlavního města Prahy; A
Primátor hlavního města Prahy je z výkonu své funkce odpovědný;zastupitelstvu hlavního města Prahy a radě hlavního města Prahy v oblastech působnosti jim svěřených;radě hlavního města Prahy;zastupitelstvu hlavního města Prahy; C
Právní jednání, která vyžadují schválení zastupitelstva hlavního města Prahy nebo rady hlavního města Prahy, provedená primátorem hlavního města Prahy bez tohoto schválení jsou;neplatná v případě, že ten, komu zákon toto právo přiznává, podá soudu návrh, aby určil jejich neplatnost;platná;neplatná; C
K platnému usnesení zastupitelstva hlavního města Prahy je třeba;souhlasu nadpoloviční většiny přítomných členů zastupitelstva, je-li přítomna alespoň polovina všech členů zastupitelstva hlavního města Prahy;souhlasu nadpoloviční většiny přítomných členů zastupitelstva, je-li přítomna alespoň jedna třetina všech členů zastupitelstva hlavního města Prahy;souhlasu nadpoloviční většiny všech členů zastupitelstva hlavního města Prahy; C
Zastupitelstvu hlavního města Prahy je vyhrazeno;stanovit výši odměny uvolněných členů rady hlavního města Prahy;určovat funkce, pro které budou členové zastupitelstva hlavního města Prahy uvolněni;stanovit počet členů rady hlavního města Prahy; B
Zastupitelstvu hlavního města Prahy je vyhrazeno;zřizovat a rušit výbory zastupitelstva hlavního města Prahy a volit jejich členy;zřizovat a rušit odbory Magistrátu hlavního města Prahy;zřizovat a rušit zvláštní orgány hlavního města Prahy a volit jejich členy; A
Zastupitelstvu hlavního města Prahy je vyhrazeno vydávat;nařízení hlavního města Prahy;obecně závazné vyhlášky hlavního města Prahy;právní předpisy hlavního města Prahy; B
Práv a povinností člena zastupitelstva hlavního města Prahy nabývá člen zastupitelstva hlavního města Prahy;složením slibu;dnem konání prvního zasedání zastupitelstva hlavního města Prahy, jehož se po svém zvolení zúčastní;zvolením; C
Mandát člena zastupitelstva hlavního města Prahy vzniká;složením slibu;zvolením;rozhodnutím volební komise; B
Právní předpis hlavního města Prahy může nabýt účinnosti nejdříve;vyhlášením ve Sbírce  právních předpisů  územních samosprávných  celků a některých správních úřadů, je-li pro to důvod spočívající v ohrožení života, zdraví, majetku nebo životního prostředí;počátkem patnáctého dne následujícího po dni jeho vyhlášení ve Sbírce právních předpisů územních samosprávných celků a některých správních úřadů;dnem stanoveným příslušným orgánem hlavního města Prahy, který právní předpis schválil; A
Právní předpis hlavního města Prahy nabývá účinnosti;dvacátým dnem následujícím po dni jeho vyhlášení ve Sbírce právních předpisů územních samosprávných celků a některých správních úřadů, pokud v něm není stanoven pozdější počátek účinnosti;"počátkem patnáctého dne následujícího po dni jeho vyhlášení ve Sbírce právních předpisů územních samosprávných celků a některých správních úřadů, pokud není stanovena účinnost pozdější. Vyžaduje-li to naléhavý obecný zájem, lze výjimečně stanovit dřívější počátek jeho účinnosti, nejdříve však počátkem dne následujícího po dni jeho vyhlášení; je-li pro to důvod spočívající v ohrožení života, zdraví, majetku nebo životního prostředí, lze stanovit, že právní předpis nabude účinnosti vyhlášením";desátým dnem následujícím po dni jeho vyhlášení ve Sbírce právních předpisů územních samosprávných celků a některých správních úřadů, pokud v něm není stanoven pozdější počátek účinnosti; B
Vyhlášení právního předpisu hlavního města Prahy se provede tak, že se právní předpis zveřejní;ve Sbírce právních předpisů územních samosprávných celků a některých správních úřadů;ve Sbírce právních předpisů hlavního města Prahy;ve Sbírce zákonů České republiky; A
Pokud městská část hlavního města Prahy nezveřejní záměr prodat, směnit, darovat, pronajmout nebo poskytnout jako výpůjčku nemovitý majetek hlavního města Prahy, je právní jednání;neplatné;neplatné za předpokladu, že ten, komu zákon toto právo přiznává, uplatní námitku neplatnosti právního jednání;platné; A
Statut hlavního města Prahy se vydává;nařízením hlavního města Prahy;vyhláškou Ministerstva vnitra;obecně závaznou vyhláškou hlavního města Prahy; C
O odvoláních proti rozhodnutím městských částí hlavního města Prahy o uložení pokuty právnické osobě nebo podnikateli, kteří neudržují čistotu a pořádek na jimi užívaném pozemku, rozhoduje;rada hlavního města Prahy;primátor hlavního města Prahy;Magistrát hlavního města Prahy; C
Hlavní město Praha se při výkonu samostatné působnosti řídí;zákony, jinými právními předpisy a v jejich mezích též usneseními vlády a směrnicemi ústředních správních úřadů;zákony a jinými právními předpisy;pouze zákonem o hlavním městě Praze a Statutem hlavního města Prahy; B
Názvy městských částí hlavního města Prahy stanoví;zákon o hlavním městě Praze;Statut hlavního města Prahy;vyhláška Ministerstva vnitra vydaná na základě zákona o územním členění státu; B
Občanem hlavního města Prahy je;fyzická osoba, která je hlášena k trvalému pobytu v hlavním městě Praze a je státním občanem ČR;fyzická osoba, která je hlášena k trvalému pobytu v hlavním městě Praze, je státním občanem ČR a dosáhla věku 18 let;fyzická osoba, která je hlášena k trvalému pobytu na území hlavního města Prahy; A
Orgány městské části hlavního města Prahy jsou;zastupitelstvo městské části, rada městské části, starosta městské části, úřad městské části a komise rady městské části, je-li jim svěřen výkon státní správy;zastupitelstvo městské části, rada městské části, starosta městské části, úřad městské části, zvláštní orgány městské části a komise rady městské části, je-li jim svěřen výkon státní správy;zastupitelstvo městské části, rada městské části, starosta městské části, úřad městské části a zvláštní orgány městské části; C
Městské části hlavního města Prahy;v rozsahu stanoveném zákonem a Statutem vystupují v právních vztazích svým jménem a nesou odpovědnost z těchto vztahů vyplývající;jednají v záležitostech svěřených jim zákonem a v mezích zákona Statutem za hlavní město Prahu;jsou právnickými osobami; A
Hlavní město Praha se podle zákona o hlavním městě Praze člení na;městské obvody;městské části;správní obvody; B
Je-li usnesení, rozhodnutí nebo opatření orgánu městské části hlavního města Prahy v přenesené působnosti v rozporu se zákonem nebo jiným právním předpisem, usnesením vlády, směrnicí ústředního správního úřadu, zruší jej;rada hlavního města Prahy;Magistrát hlavního města Prahy;primátor hlavního města Prahy; B
Zastupitelstvo kraje rozhoduje ve věcech;patřících do přenesené působnosti;"patřících do samostatné působnosti; ve věcech přenesené působnosti rozhoduje, jen stanoví-li tak zákon";patřících do samostatné nebo přenesené působnosti; B
K přijetí usnesení, rozhodnutí nebo k volbě zastupitelstva kraje je potřeba souhlasu;nadpoloviční většiny všech členů zastupitelstva kraje;všech přítomných členů zastupitelstva kraje;nadpoloviční většiny přítomných členů zastupitelstva kraje; A
Zastupitelstvu kraje je vyhrazeno rozhodovat;pouze o otázkách, které si vyhradí;jen o otázkách, které jsou mu vyhrazeny zákonem;o otázkách, které jsou mu vyhrazeny zákonem a o ostatních otázkách samostatné působnosti, které nejsou vyhrazeny radě, pokud si to zastupitelstvo kraje vyhradí; C
Členové zastupitelstva kraje jsou voleni;Sborem krajských volitelů, který je volen občany obce ve volbách do zastupitelstva obce;ve volbách do zastupitelstev krajů oprávněnými voliči podle zvláštního zákona;občany České republiky ve volbách do Poslanecké sněmovny Parlamentu České republiky; B
Mandát člena zastupitelstva kraje vzniká;složením slibu člena zastupitelstva kraje;zvolením;písemným souhlasem; B
Člen zastupitelstva kraje je povinen;zúčastňovat se zasedání zastupitelstva kraje, popřípadě zasedání jiných orgánů kraje, je-li jejich členem;zúčastňovat se zasedání zastupitelstva kraje, popřípadě zasedání jiných orgánů kraje, přičemž mu nikdo není oprávněn ukládat úkoly;zúčastňovat se zasedání zastupitelstva kraje, popřípadě zasedání jiných orgánů kraje, je-li jejich členem, a to minimálně 4 x ročně; A
Záměr prodat, směnit nebo darovat nemovitý majetek, pronajmout jej anebo poskytnout jako výpůjčku je kraj povinen;zveřejnit jej po dobu nejméně 30 dnů před rozhodnutím v příslušném orgánu kraje vyvěšením na úřední desce krajského úřadu, aby se k němu mohli zájemci vyjádřit a předložit své nabídky;nabídnout k přednostnímu využití obcím v kraji;nabídnout k přednostnímu využití organizačním složkám kraje; A
Právní jednání kraje schvaluje;vždy zastupitelstvo kraje;"zastupitelstvo kraje nebo rada kraje, jedná-li se o právní jednání, která vyžadují schválení tímto orgánem; pokud tato právní jednání neschválí příslušný orgán kraje, jsou tato právní jednání neplatná, přičemž k neplatnosti právních jednání z tohoto důvodu přihlédne soud i bez návrhu";vždy hejtman; B
Hospodaření s majetkem kraje a jeho správa patří;do samostatné působnosti kraje, stanoví-li tak zastupitelstvo kraje;do přenesené působnosti kraje, stanoví-li tak rada kraje;do samostatné působnosti kraje; C
Krajský úřad v přenesené působnosti kontroluje v potřebném rozsahu a s využitím prostředků, které zákon dává k dispozici:;činnost orgánů obcí při výkonu přenesené působnosti;činnost orgánů obcí při výkonu samostatné působnosti;činnost orgánů obcí při výkonu samostatné i přenesené působnosti; A
Při vydání obecně závazné vyhlášky v rámci výkonu samostatné působnosti se kraj řídí;zákonem;zákonem, jinými právními předpisy a usneseními vlády;zákonem a jinými právními předpisy; A
Při vydání nařízení kraje v rámci výkonu přenesené působnosti se orgány kraje řídí;zákony a usneseními vlády;zákony a jinými právními předpisy vydanými vládou a ústředními správními úřady;pouze zákony; B
Právo volit do zastupitelstva kraje má za podmínek stanovených zvláštním zákonem;občan kraje, který dosáhl věku 18 let a vlastní na území obce nemovitost;občan České republiky, který dosáhl věku 18 let a je přihlášen k trvalému pobytu v některé obci v územním obvodu kraje;občan kraje, který dosáhl věku 18 let a dále fyzická osoba, která dosáhla věku 18 let a vlastní na území obce nemovitost; B
Nestanoví-li zákon jinak, může pro výkon své samostatné působnosti kraj;zakládat a zřizovat právnické osoby a organizační složky kraje;zakládat a zřizovat právnické osoby a organizační složky státu;zakládat a zřizovat právnické osoby a organizační složky obce; A
Nařízení kraje vydává;zastupitelstvo kraje;hejtman kraje;rada kraje; C
Právní předpis kraje nabývá účinnosti;dnem přijetí příslušným orgánem kraje;"počátkem patnáctého dne následujícího po dni jeho vyhlášení ve Sbírce právních předpisů územních samosprávných celků a některých správních úřadů, pokud není stanovena účinnost pozdější. Vyžaduje-li to naléhavý obecný zájem, lze výjimečně stanovit dřívější počátek jejich účinnosti, nejdříve však počátkem dne následujícího po dni jejich vyhlášení; je-li pro to důvod spočívající v ohrožení života, zdraví, majetku nebo životního prostředí, lze stanovit, že právní předpis nabude účinnosti vyhlášením.";dnem podpisu hejtmanem kraje; B
Občan kraje je oprávněn;vyjadřovat se k návrhu rozpočtu kraje a k závěrečnému účtu kraje;schvalovat rozpočet kraje;rozhodovat o územním plánu kraje; A
Obecně závaznou vyhlášku kraje schvaluje;hejtman kraje;krajský úřad;zastupitelstvo kraje; C
Obecně závaznou vyhláškou kraje lze ukládat fyzickým a právnickým osobám povinnosti,;rozhodne-li tak krajský úřad;usnese-li se o tom rada kraje;jen stanoví-li tak zákon; C
Přenesenou působnost v kraji vykonává;krajský úřad, s výjimkou věcí, které jsou zákonem svěřeny radě kraje, zastupitelstvu kraje nebo zvláštnímu orgánu kraje;rada kraje, s výjimkou věcí, které jsou zákonem svěřeny zastupitelstvu kraje;pouze krajský úřad; A
Krajský úřad;přezkoumává rozhodnutí vydaná orgány obcí ve správním řízení, pokud není zákonem tato působnost svěřena zvláštnímu orgánu kraje nebo zákon nestanoví jinak;přezkoumává jen rozhodnutí vydaná ve správním řízení orgány obcí s pověřeným obecním úřadem a obcí s rozšířenou působností, pokud není zákonem tato působnost svěřena zvláštnímu orgánu kraje nebo zákon nestanoví jinak;přezkoumává jen rozhodnutí vydaná orgány obcí s rozšířenou působností ve správním řízení, pokud není zákonem tato působnost svěřena zvláštnímu orgánu kraje nebo zákon nestanoví jinak; A
Zvláštní orgány kraje zřizuje;hejtman;rada kraje;ředitel krajského úřadu; A
Ze své činnosti a za plnění úkolů je hejtman odpovědný;ministrovi vnitra;radě kraje;zastupitelstvu kraje; C
Hejtmana kraje do funkce volí;zastupitelstvo kraje;kontrolní výbor zastupitelstva kraje;rada kraje; A
Radě kraje je vyhrazeno;volit hejtmana;rozhodovat v ostatních otázkách samostatné působnosti kraje, pokud si je zastupitelstvo vyhradilo;vydávat nařízení kraje; C
Schůze rady kraje jsou;veřejné;neveřejné;tajné; B
Rada kraje je usnášeníschopná,;je-li přítomna alespoň třetina členů rady kraje;je-li přítomna alespoň polovina členů rady kraje;je-li přítomna nadpoloviční většina všech členů rady kraje; C
Radu kraje volí a odvolává;Ministerstvo vnitra;hejtman kraje;zastupitelstvo kraje; C
Zastupitelstvo kraje se schází;podle potřeby, nejméně však třikrát do roka;podle potřeby, nejméně však jedenkrát za tři měsíce;podle potřeby; B
Zastupitelstvo kraje je usnášeníschopné,;je-li přítomna nadpoloviční většina všech členů zastupitelstva kraje;je-li přítomna alespoň polovina členů zastupitelstva kraje;je-li přítomna alespoň třetina členů zastupitelstva; A
Zastupitelstvo kraje je oprávněno vyhradit si z věcí patřících do samostatné působnosti kraje;veškeré pravomoci v samostatné působnosti kraje bez jakékoliv výjimky;další pravomoci v samostatné působnosti kraje s výjimkou pravomocí, které zákon vyhrazuje radě kraje;veškeré pravomoci v samostatné působnosti kraje bez ohledu na to, kterému orgánu svěřuje zákon příslušnou pravomoc, avšak vždy po předchozím souhlasu příslušného orgánu; B
O záležitostech, které jsou zákonem vyhrazeny do pravomoci zastupitelstva kraje, rozhoduje;pouze zastupitelstvo kraje, přičemž je oprávněno některou z těchto pravomocí svěřit radě kraje;pouze zastupitelstvo kraje, přičemž je oprávněno některou z těchto pravomocí svěřit některému z orgánů kraje;pouze zastupitelstvo kraje, přičemž žádnou z těchto pravomocí není oprávněno zastupitelstvo svěřit jinému orgánu kraje; C
Krajský úřad kontroluje výkon přenesené působnosti;jen u obcí s rozšířenou působností ve svém správním obvodu;pouze u obcí s pověřeným obecním úřadem ve svém správním obvodu;u obcí ve svém správním obvodu; C
Ředitel krajského úřadu;je vždy členem zastupitelstva kraje;se zúčastňuje jednání rady kraje s právem hlasovat;nesmí vykonávat funkce v politických stranách a v politických hnutích; C
